{
  "schema_version": "1.0.0",
  "document_id": "rain-engine-trial-S2-reconstruction",
  "revision": 1,
  "coordinate_system": "normalized_top_left_xywh",
  "provenance": {
    "kind": "image_analysis",
    "note": "Manually inspected the actual generated trial-S2 PNG. Dimensions read from its PNG header; element bounds estimated visually. This is a new visual reconstruction specification, not the original prompt or recovered source layers."
  },
  "intent": {
    "task": "reconstruct",
    "purpose": "Recreate the visible Rain Engine atlas illustration with its hierarchy, distinct components, exact labels and flow topology.",
    "exactness": "perceptual",
    "exactness_note": "Target recognizable visual fidelity and correct content/relationships. Estimated rectangles do not specify exact silhouettes or promise pixel equality.",
    "output": {
      "width_px": 1024,
      "height_px": 1536,
      "format": "png",
      "crop_policy": "preserve"
    }
  },
  "coverage": {
    "status": "complete_visible_inventory",
    "granularity": "50 meaningful editable regions in 10 groups; microtexture, individual rocks, tiny flowers, every fastener and small shelf-like details remain grouped.",
    "excluded_regions": [],
    "notes": [
      "A complete inventory at the declared control granularity, not every pixel or every hidden object.",
      "Several boxes overlap because the flat illustration contains nested subjects, transparency and occlusion.",
      "No segmentation, OCR automation, hidden-layer recovery or automatic object detection was performed."
    ]
  },
  "source_images": [
    {
      "id": "A",
      "path": "../assets/rain-engine.png",
      "version": "trial-S2-clean",
      "width_px": 1024,
      "height_px": 1536,
      "dimensions_basis": "file_metadata",
      "role": "target",
      "selected_for_use": true,
      "allowed_roles": [
        "content",
        "layout",
        "style",
        "palette",
        "material",
        "lighting",
        "typography"
      ],
      "scope_note": "Use the clean Rain Engine image for its visible scene, arrangement and appearance. Never copy mapping overlays or interface badges."
    }
  ],
  "scene": {
    "medium": {
      "value": "Highly detailed natural-history atlas / technical-fantasy illustration, with fine contours, painterly shading and an ivory paper ground.",
      "status": "inferred",
      "basis": "visual_estimate",
      "confidence": "medium",
      "note": ""
    },
    "composition": {
      "value": "Tall 2:3 page. Five vertically ordered tiers share a central axis; the title spans the top; five tier labels sit on image-left; a large return arrow climbs image-right.",
      "status": "observed",
      "basis": "visual_observation",
      "confidence": "high",
      "note": ""
    },
    "view": {
      "value": "Elevated three-quarter views reveal the tops of circular platforms, vessel and coil.",
      "status": "inferred",
      "basis": "visual_estimate",
      "confidence": "medium",
      "note": ""
    },
    "lighting": {
      "value": "Soft broad illumination with pale upper-left highlights, darker undersides and coherent material shading.",
      "status": "inferred",
      "basis": "visual_estimate",
      "confidence": "medium",
      "note": ""
    },
    "palette": {
      "value": "Ivory background, dark teal type and leaders, turquoise water and return arrow, warm copper/gold structures, green garden.",
      "status": "observed",
      "basis": "visual_observation",
      "confidence": "high",
      "note": ""
    },
    "text": {
      "value": "Only the title and five uppercase tier labels are legible words in this reference.",
      "status": "observed",
      "basis": "visual_observation",
      "confidence": "high",
      "note": ""
    },
    "camera_lens": {
      "value": null,
      "status": "unknown",
      "basis": "unknown",
      "confidence": "unknown",
      "note": "An exact camera/lens cannot be inferred from this illustration."
    }
  },
  "groups": [
    {
      "id": "A-G01",
      "source_id": "A",
      "parent_id": null,
      "name": "Typography and label leaders",
      "bbox": [
        0.0537109375,
        0.01171875,
        0.740234375,
        0.875
      ],
      "geometry_basis": "visual_estimate",
      "note": "Named control group inferred from the visible composition; not a recovered editable layer."
    },
    {
      "id": "A-G02",
      "source_id": "A",
      "parent_id": null,
      "name": "Cloud collection tier",
      "bbox": [
        0.193359375,
        0.048828125,
        0.64453125,
        0.203125
      ],
      "geometry_basis": "visual_estimate",
      "note": "Named control group inferred from the visible composition; not a recovered editable layer."
    },
    {
      "id": "A-G03",
      "source_id": "A",
      "parent_id": null,
      "name": "Filter tier",
      "bbox": [
        0.2958984375,
        0.2721354166666667,
        0.3935546875,
        0.11002604166666667
      ],
      "geometry_basis": "visual_estimate",
      "note": "Named control group inferred from the visible composition; not a recovered editable layer."
    },
    {
      "id": "A-G04",
      "source_id": "A",
      "parent_id": null,
      "name": "Water vault tier",
      "bbox": [
        0.3154296875,
        0.3984375,
        0.3505859375,
        0.20247395833333334
      ],
      "geometry_basis": "visual_estimate",
      "note": "Named control group inferred from the visible composition; not a recovered editable layer."
    },
    {
      "id": "A-G05",
      "source_id": "A",
      "parent_id": null,
      "name": "Garden tier",
      "bbox": [
        0.251953125,
        0.5904947916666666,
        0.505859375,
        0.205078125
      ],
      "geometry_basis": "visual_estimate",
      "note": "Named control group inferred from the visible composition; not a recovered editable layer."
    },
    {
      "id": "A-G06",
      "source_id": "A",
      "parent_id": null,
      "name": "Return coil and vapor",
      "bbox": [
        0.26953125,
        0.7239583333333334,
        0.626953125,
        0.25390625
      ],
      "geometry_basis": "visual_estimate",
      "note": "Named control group inferred from the visible composition; not a recovered editable layer."
    },
    {
      "id": "A-G07",
      "source_id": "A",
      "parent_id": null,
      "name": "Flow arrows",
      "bbox": [
        0.47265625,
        0.12630208333333334,
        0.41015625,
        0.7721354166666666
      ],
      "geometry_basis": "visual_estimate",
      "note": "Named control group inferred from the visible composition; not a recovered editable layer."
    },
    {
      "id": "A-G08",
      "source_id": "A",
      "parent_id": null,
      "name": "Background and useful empty regions",
      "bbox": [
        0,
        0,
        1,
        1
      ],
      "geometry_basis": "visual_estimate",
      "note": "Named control group inferred from the visible composition; not a recovered editable layer."
    },
    {
      "id": "A-G09",
      "source_id": "A",
      "parent_id": "A-G05",
      "name": "Garden bridges",
      "bbox": [
        0.390625,
        0.625,
        0.19140625,
        0.07747395833333333
      ],
      "geometry_basis": "visual_estimate",
      "note": "Named control group inferred from the visible composition; not a recovered editable layer."
    },
    {
      "id": "A-G10",
      "source_id": "A",
      "parent_id": "A-G05",
      "name": "Garden terraces",
      "bbox": [
        0.259765625,
        0.6412760416666666,
        0.47265625,
        0.14518229166666666
      ],
      "geometry_basis": "visual_estimate",
      "note": "Named control group inferred from the visible composition; not a recovered editable layer."
    }
  ],
  "elements": [
    {
      "id": "A-01",
      "source_id": "A",
      "parent_id": "A-G08",
      "name": "warm paper background",
      "kind": "background",
      "bbox": [
        0,
        0,
        1,
        1
      ],
      "geometry_basis": "visual_estimate",
      "count": 1,
      "description": {
        "value": "Continuous pale ivory ground with subtle mottled paper-like texture.",
        "status": "observed",
        "basis": "visual_observation",
        "confidence": "high",
        "note": ""
      },
      "appearance": {
        "color": {
          "value": "ivory",
          "status": "observed",
          "basis": "visual_observation",
          "confidence": "high",
          "note": ""
        },
        "material": {
          "value": "paper-like flat ground",
          "status": "inferred",
          "basis": "visual_estimate",
          "confidence": "medium",
          "note": "Material interpretation based on the illustrated surface; no original rendering material was recovered."
        }
      },
      "text": null,
      "occlusion": {
        "boundary": "complete",
        "occluded_by": [],
        "hidden_content": "not_applicable",
        "note": "Bounds estimate the visible control region, not an isolated silhouette."
      },
      "asset": {
        "kind": "none",
        "path": null,
        "alpha_verified": false,
        "note": "No layer asset extracted. The HTML mapper shows a bounding crop preview containing neighboring/background pixels."
      },
      "editable_properties": [
        "appearance.color",
        "appearance.material",
        "description",
        "bbox"
      ],
      "locked_properties": []
    },
    {
      "id": "A-02",
      "source_id": "A",
      "parent_id": "A-G01",
      "name": "main title",
      "kind": "text",
      "bbox": [
        0.2021484375,
        0.013020833333333334,
        0.5869140625,
        0.034505208333333336
      ],
      "geometry_basis": "visual_estimate",
      "count": 1,
      "description": {
        "value": "One large uppercase serif title.",
        "status": "observed",